{
  "sessionId": "2025-09-07_11-26-16_connector-scripts-mobile-issue-usman-20250907",
  "sessionName": "connector-scripts-mobile-issue-usman-20250907",
  "platform": "staging",
  "startTime": "2025-09-07T11:26:16.613Z",
  "endTime": "2025-09-07T11:36:04.429Z",
  "status": "closed",
  "objective": "connector-scripts-mobile-issue-usman-20250907",
  "files": {
    "rules": ".cursorrules",
    "notes": "session-notes.md",
    "chatHistory": "chat-history.md",
    "summary": "session-summary.md"
  },
  "tags": [],
  "participants": [],
  "duration": "10m"
}