{
  "sessionId": "2025-09-20_08-12-41_organization-statistics-excel",
  "sessionName": "organization-statistics-excel",
  "platform": "staging",
  "startTime": "2025-09-20T08:12:41.233Z",
  "endTime": "2025-09-20T21:40:30.130Z",
  "status": "closed",
  "objective": "organization-statistics-excel",
  "files": {
    "rules": ".cursorrules",
    "notes": "session-notes.md",
    "chatHistory": "chat-history.md",
    "summary": "session-summary.md"
  },
  "tags": [],
  "participants": [],
  "duration": "13h 28m"
}