{
  "sessionId": "2025-09-08_20-30-00_overall-system-health-test",
  "sessionName": "overall-system-health-test",
  "platform": "staging",
  "startTime": "2025-09-08T20:30:00.000Z",
  "endTime": null,
  "status": "active",
  "objective": "overall-system-health-test",
  "files": {
    "rules": ".cursorrules",
    "notes": "session-notes.md",
    "chatHistory": "chat-history.md",
    "summary": "session-summary.md"
  },
  "tags": [],
  "participants": []
}
