{
  "sessionId": "2025-09-07_09-13-29_test-redis-performance-issue",
  "sessionName": "test-redis-performance-issue",
  "platform": "staging",
  "startTime": "2025-09-07T09:13:29.963Z",
  "endTime": "2025-09-07T09:14:01.442Z",
  "status": "closed",
  "objective": "test-redis-performance-issue",
  "files": {
    "rules": ".cursorrules",
    "notes": "session-notes.md",
    "chatHistory": "chat-history.md",
    "summary": "session-summary.md"
  },
  "tags": [],
  "participants": [],
  "duration": "1m"
}