{
  "sessionId": "2025-09-08_19-37-12_test-new-summary-format",
  "sessionName": "test-new-summary-format",
  "platform": "staging",
  "startTime": "2025-09-08T19:37:12.712Z",
  "endTime": null,
  "status": "active",
  "objective": "test-new-summary-format",
  "files": {
    "rules": ".cursorrules",
    "notes": "session-notes.md",
    "chatHistory": "chat-history.md",
    "summary": "session-summary.md"
  },
  "tags": [],
  "participants": []
}